[
  {
    "id": "rails-metro-tram-001",
    "number": 5,
    "title": "Sur les rails",
    "intro": "Connecte les mots avant la prochaine station.",
    "finalNote": "Cette grille vient des exports structurés Ilévia et MEL : stations, lignes et communes desservies, sans reprendre les textes des pages web.",
    "status": "reviewed",
    "tags": ["transport", "metro", "tramway", "metropole"],
    "sourceIds": [
      "gtfs-ilevia-data-gouv",
      "ilevia-arret-point-datamel",
      "mel-communes-datamel"
    ],
    "bonus": {
      "question": "La ligne 1 dessert Villeneuve-d'Ascq et Lille.",
      "answer": true,
      "explanation": "Vrai. Les exports structurés rattachent des stations de la ligne 1 à Villeneuve-d'Ascq, Hellemmes-Lille et Lille."
    },
    "groups": [
      {
        "id": "m1-villeneuve-ascq",
        "title": "Stations de la ligne 1",
        "difficulty": "easy",
        "sourceIds": ["gtfs-ilevia-data-gouv", "ilevia-arret-point-datamel"],
        "items": [
          "4 Cantons Stade P. Mauroy",
          "Cité Scientifique",
          "Triolo",
          "Pont de Bois"
        ],
        "note": "Quatre stations de la ligne 1 côté Villeneuve-d'Ascq."
      },
      {
        "id": "m2-tourcoing-nord",
        "title": "Stations de la ligne 2",
        "difficulty": "medium",
        "sourceIds": ["gtfs-ilevia-data-gouv", "ilevia-arret-point-datamel"],
        "items": [
          "C.H. Dron",
          "Bourgogne",
          "Pont de Neuville",
          "Phalempins"
        ],
        "note": "Un paquet de stations au nord de la ligne 2."
      },
      {
        "id": "tram-wasquehal",
        "title": "Arrêts du tramway",
        "difficulty": "hard",
        "sourceIds": ["gtfs-ilevia-data-gouv", "ilevia-arret-point-datamel"],
        "items": [
          "Clemenceau Hippodrome",
          "Croisé Laroche",
          "Acacias",
          "Pont de Wasquehal"
        ],
        "note": "Le tramway file aussi par des repères de la métropole nord-est."
      },
      {
        "id": "communes-metro-mel",
        "title": "Communes desservies par le métro",
        "difficulty": "tricky",
        "sourceIds": ["mel-communes-datamel", "gtfs-ilevia-data-gouv"],
        "items": [
          "Mons-en-Barœul",
          "Roubaix",
          "Tourcoing",
          "Villeneuve-d'Ascq"
        ],
        "note": "Des communes MEL où le métro laisse une trace nette dans les données."
      }
    ]
  },
  {
    "id": "quartiers-territoires-001",
    "number": 6,
    "title": "Quartiers et territoires",
    "intro": "Connecte les mots avant la prochaine station.",
    "finalNote": "La grille mélange quartiers officiels et territoires MEL : le piège est de séparer Lille, Lomme, Hellemmes et le reste de la métropole.",
    "status": "reviewed",
    "tags": ["quartiers", "communes", "gastronomie", "metropole"],
    "sourceIds": ["ville-lille-quartiers-data-gouv", "mel-communes-datamel", "banque-chtimi-gastronomie-jeux", "comptoir-flandres-dictionnaire-chti"],
    "bonus": {
      "question": "Les exports de quartiers distinguent Lille, Lomme et Hellemmes.",
      "answer": true,
      "explanation": "Vrai. Le corpus structuré conserve la commune associée à chaque quartier officiel."
    },
    "groups": [
      {
        "id": "quartiers-officiels-est",
        "title": "Quartiers officiels",
        "difficulty": "easy",
        "sourceIds": ["ville-lille-quartiers-data-gouv"],
        "items": [
          "Bois-Blancs",
          "Faubourg de Béthune",
          "Fives",
          "Hellemmes"
        ],
        "note": "Quatre entrées du jeu de données des quartiers Lille-Lomme-Hellemmes."
      },
            {
        "id": "douceurs-nord-1",
        "title": "Douceurs du Nord",
        "difficulty": "medium",
        "sourceIds": ["banque-chtimi-gastronomie-jeux", "comptoir-flandres-dictionnaire-chti"],
        "items": [
          "Merveilleux",
          "Babelutte",
          "Cramique",
          "Vergeoise"
        ],
        "note": "Des douceurs typiques du Nord."
      },
      {
        "id": "communes-couronne-sud",
        "title": "Territoire de la couronne Sud",
        "difficulty": "hard",
        "sourceIds": ["mel-communes-datamel"],
        "items": [
          "Allennes-les-Marais",
          "Annœullin",
          "Bauvin",
          "Carnin"
        ],
        "note": "Quatre communes rattachées à la couronne Sud dans l'export MEL."
      },
      {
        "id": "communes-territoire-est",
        "title": "Territoire Est",
        "difficulty": "tricky",
        "sourceIds": ["mel-communes-datamel"],
        "items": [
          "Anstaing",
          "Baisieux",
          "Bouvines",
          "Chéreng"
        ],
        "note": "Un groupe de communes du territoire Est, utile pour sortir du centre-ville."
      }
    ]
  },
  {
    "id": "rames-rives-001",
    "number": 7,
    "title": "Rames et rives",
    "intro": "Connecte les mots avant la prochaine station.",
    "finalNote": "Ici, le corpus joue la carte des lignes : deux séries métro, une série tram et un groupe de communes du Tourquennois.",
    "status": "reviewed",
    "tags": ["transport", "metro", "tramway", "communes"],
    "sourceIds": [
      "gtfs-ilevia-data-gouv",
      "ilevia-arret-point-datamel",
      "mel-communes-datamel"
    ],
    "bonus": {
      "question": "Villa Cavrois et Parc Barbieux apparaissent dans les données tramway.",
      "answer": true,
      "explanation": "Vrai. Ces deux arrêts figurent dans l'export structuré métro-tram utilisé pour le corpus."
    },
    "groups": [
      {
        "id": "m1-centre-lille",
        "title": "Stations de la ligne 1",
        "difficulty": "easy",
        "sourceIds": ["gtfs-ilevia-data-gouv", "ilevia-arret-point-datamel"],
        "items": [
          "Fives",
          "Madeleine Caulier",
          "Gambetta",
          "Rihour"
        ],
        "note": "Quatre stations de la ligne 1 dans la traversée lilloise."
      },
      {
        "id": "m2-ouest-lille",
        "title": "Stations de la ligne 2",
        "difficulty": "medium",
        "sourceIds": ["gtfs-ilevia-data-gouv", "ilevia-arret-point-datamel"],
        "items": [
          "Bois Blancs",
          "Montebello",
          "Cormontaigne",
          "Port de Lille"
        ],
        "note": "La ligne 2, côté ouest lillois, avant de filer plus loin."
      },
      {
        "id": "tram-barbieux-cavrois",
        "title": "Arrêts du tramway",
        "difficulty": "hard",
        "sourceIds": ["gtfs-ilevia-data-gouv", "ilevia-arret-point-datamel"],
        "items": [
          "La Marque",
          "Villa Cavrois",
          "Bol d'Air",
          "Parc Barbieux"
        ],
        "note": "Quatre arrêts du tramway entre repères verts et architecture connue."
      },
      {
        "id": "communes-tourquennois-lys",
        "title": "Tourquennois - Vallée de la Lys",
        "difficulty": "tricky",
        "sourceIds": ["mel-communes-datamel"],
        "items": [
          "Bondues",
          "Bousbecque",
          "Comines",
          "Halluin"
        ],
        "note": "Quatre communes du territoire Tourquennois - Vallée de la Lys."
      }
    ]
  },
  {
    "id": "tourcoing-weppes-001",
    "number": 8,
    "title": "Tourcoing et Weppes",
    "intro": "Connecte les mots avant la prochaine station.",
    "finalNote": "Cette grille transforme quatre familles candidates en contenu jouable : deux lignes à suivre, deux territoires à reconnaître.",
    "status": "reviewed",
    "tags": ["transport", "metro", "tramway", "communes"],
    "sourceIds": [
      "gtfs-ilevia-data-gouv",
      "ilevia-arret-point-datamel",
      "mel-communes-datamel"
    ],
    "bonus": {
      "question": "Le tramway relie Lille à Roubaix et Tourcoing.",
      "answer": true,
      "explanation": "Vrai. Le tramway, le célèbre Mongy, compte deux branches : l'une vers Roubaix, l'autre vers Tourcoing."
    },
    "groups": [
      {
        "id": "m2-tourcoing-centre",
        "title": "Stations de la ligne 2",
        "difficulty": "easy",
        "sourceIds": ["gtfs-ilevia-data-gouv", "ilevia-arret-point-datamel"],
        "items": [
          "Colbert",
          "Phalempins",
          "Gare de Tourcoing",
          "Carliers"
        ],
        "note": "Quatre stations de la ligne 2 dans le secteur tourquennois."
      },
      {
        "id": "tram-wasquehal-sart",
        "title": "Arrêts du tramway",
        "difficulty": "medium",
        "sourceIds": ["gtfs-ilevia-data-gouv", "ilevia-arret-point-datamel"],
        "items": [
          "La Terrasse",
          "Hopital Victor Provo",
          "Le Sart",
          "Planche Epinoy"
        ],
        "note": "Une série d'arrêts du tramway sur la branche vers Roubaix."
      },
      {
        "id": "communes-armentierois-lys",
        "title": "Armentiérois - Vallée de la Lys",
        "difficulty": "hard",
        "sourceIds": ["mel-communes-datamel"],
        "items": [
          "Armentières",
          "Deûlémont",
          "Erquinghem-Lys",
          "Frelinghien"
        ],
        "note": "Quatre communes du territoire Armentiérois - Vallée de la Lys."
      },
      {
        "id": "communes-weppes-ouest",
        "title": "Territoire des Weppes",
        "difficulty": "tricky",
        "sourceIds": ["mel-communes-datamel"],
        "items": [
          "Aubers",
          "Beaucamps-Ligny",
          "Bois-Grenier",
          "Don"
        ],
        "note": "Quatre communes des Weppes, loin des automatismes du centre."
      }
    ]
  },
  {
    "id": "roubaix-mons-weppes-001",
    "number": 9,
    "title": "Roubaix, Mons et Weppes",
    "intro": "Connecte les mots avant la prochaine station.",
    "finalNote": "Le corpus gagne ici des cartes hors Lille intra-muros, avec des stations de métro et des communes de territoires distincts.",
    "status": "reviewed",